{
  "schema_version": "sensekit.policy_decision.v1",
  "event_type": "driving_started",
  "allowed_actions": [
    "send_voice_note",
    "send_tts",
    "send_short_text"
  ],
  "blocked_actions": [
    "send_long_markdown"
  ],
  "delivery_channel_preference": [
    "voice_note",
    "tts",
    "short_text"
  ],
  "ttl_sec": 1800
}

